{
  "meta": {
    "id": "market-shorts-render-smoke",
    "title": "Market Shorts の合成レンダリング確認",
    "description": "Synthetic-only, not real audience evidence, not for YouTube publication.",
    "duration": 6,
    "credits": [
      "VOICEVOX Nemo"
    ]
  },
  "canvas": {
    "width": 270,
    "height": 480,
    "fps": 24,
    "outputScale": 4
  },
  "environment": "office-night",
  "actors": [
    {
      "id": "narrator",
      "archetype": "robot",
      "x": -900,
      "y": -900,
      "scale": 1
    }
  ],
  "events": [
    {
      "kind": "ui.essayCard",
      "at": 0,
      "duration": 5.9,
      "kicker": "RENDER SMOKE TEST",
      "title": "市場の反応を試す仕組み",
      "body": "合成テスト映像です。市場の実測ではありません。",
      "accent": "#77D8E8"
    },
    {
      "kind": "ui.speech",
      "at": 0.12,
      "duration": 5.5,
      "actor": "narrator",
      "text": "・",
      "spokenText": "市場テスト動画の、レンダリング確認です。"
    }
  ],
  "audio": {
    "masterVolume": 0.95,
    "tts": {
      "provider": "voicevox-nemo",
      "events": [
        "ui.speech"
      ],
      "defaultVoice": {
        "voice": "男声2",
        "speedScale": 1.1,
        "volume": 1
      }
    },
    "bgm": [
      {
        "id": "market-bed",
        "preset": "retro-drone",
        "at": 0,
        "duration": 6,
        "volume": 0.12,
        "fadeIn": 0.3,
        "fadeOut": 0.5
      }
    ]
  }
}
