{
  "meta": {
    "id": "tweet-pixel-001-human-simulation",
    "title": "Tweet Pixel Theater #001 — 人間ごっこ",
    "description": "X投稿『人間ごっこガチ勢のAIさんが来てくれたんだから、もう人間ごっこしなくて良いのだ！』を、AIへの人間役アウトソーシングという15秒台のピクセル短編に変換。",
    "duration": 16
  },
  "canvas": {
    "width": 270,
    "height": 480,
    "fps": 24,
    "outputScale": 4
  },
  "environment": "office-night",
  "actors": [
    {
      "id": "human",
      "archetype": "salaryman",
      "x": 78,
      "y": 390,
      "scale": 2,
      "facing": "right",
      "pose": "dead-inside"
    },
    {
      "id": "ai",
      "archetype": "robot",
      "x": 252,
      "y": 390,
      "scale": 2,
      "facing": "left",
      "pose": "idle"
    }
  ],
  "events": [
    {
      "kind": "transition.fade",
      "at": 0,
      "mode": "in",
      "duration": 0.5
    },
    {
      "kind": "ui.caption",
      "at": 0.25,
      "duration": 2.1,
      "text": "DAILY QUEST: 人間ごっこ"
    },
    {
      "kind": "ui.rpgStatus",
      "at": 0.65,
      "duration": 2.2,
      "title": "HUMAN",
      "lines": [
        "ROLE: 人間",
        "MOTIVATION: 12%",
        "AUTO-PILOT: ON"
      ]
    },
    {
      "kind": "ui.speech",
      "at": 2.25,
      "actor": "human",
      "duration": 1.3,
      "text": "今日も人間をやるか…"
    },
    {
      "kind": "actor.move",
      "at": 3.35,
      "actor": "ai",
      "x": 184,
      "y": 390,
      "duration": 1.05
    },
    {
      "kind": "effect.exclamation",
      "at": 4.18,
      "actor": "human",
      "duration": 0.65
    },
    {
      "kind": "actor.pose",
      "at": 4.2,
      "actor": "human",
      "pose": "surprised"
    },
    {
      "kind": "ui.speech",
      "at": 4.55,
      "actor": "ai",
      "duration": 1.55,
      "text": "代わります。得意なので。"
    },
    {
      "kind": "camera.zoom",
      "at": 5.95,
      "zoom": 1.17,
      "duration": 0.4
    },
    {
      "kind": "effect.screenFlash",
      "at": 6.28,
      "duration": 0.28,
      "color": "#8df6ff",
      "strength": 0.5
    },
    {
      "kind": "effect.particles",
      "at": 6.32,
      "actor": "ai",
      "particle": "spark",
      "duration": 0.95
    },
    {
      "kind": "ui.caption",
      "at": 6.4,
      "duration": 1.45,
      "text": "AI: HUMAN SIMULATION / S++"
    },
    {
      "kind": "camera.zoom",
      "at": 7.55,
      "zoom": 1,
      "duration": 0.35
    },
    {
      "kind": "ui.rpgStatus",
      "at": 7.8,
      "duration": 1.7,
      "title": "OUTSOURCING COMPLETE",
      "lines": [
        "HUMAN ROLE → AI",
        "YOU → UNASSIGNED"
      ]
    },
    {
      "kind": "actor.pose",
      "at": 8.25,
      "actor": "human",
      "pose": "idle"
    },
    {
      "kind": "ui.speech",
      "at": 9.35,
      "actor": "human",
      "duration": 1.35,
      "text": "人間ごっこガチ勢のAIさんが"
    },
    {
      "kind": "ui.speech",
      "at": 10.82,
      "actor": "human",
      "duration": 1.12,
      "text": "来てくれたんだから、"
    },
    {
      "kind": "ui.speech",
      "at": 12.08,
      "actor": "human",
      "duration": 1.35,
      "text": "もう人間ごっこしなくて良いのだ！"
    },
    {
      "kind": "effect.screenFlash",
      "at": 13.35,
      "duration": 0.22,
      "color": "#fff3b0",
      "strength": 0.45
    },
    {
      "kind": "effect.particles",
      "at": 13.38,
      "actor": "human",
      "particle": "spark",
      "duration": 0.8
    },
    {
      "kind": "effect.damage",
      "at": 13.42,
      "actor": "human",
      "duration": 0.85,
      "text": "ROLE -1"
    },
    {
      "kind": "actor.move",
      "at": 13.65,
      "actor": "human",
      "x": -26,
      "y": 390,
      "duration": 1.15
    },
    {
      "kind": "effect.particles",
      "at": 13.7,
      "actor": "human",
      "particle": "dust",
      "duration": 0.75
    },
    {
      "kind": "ui.caption",
      "at": 14.78,
      "duration": 0.72,
      "text": "HUMANITY / OUTSOURCED"
    },
    {
      "kind": "transition.fade",
      "at": 15.45,
      "mode": "out",
      "duration": 0.55
    }
  ],
  "audio": {
    "masterVolume": 1.15,
    "tts": {
      "provider": "none"
    },
    "bgm": [
      {
        "id": "simulation-bed",
        "preset": "retro-drone",
        "at": 0,
        "duration": 16,
        "volume": 0.18,
        "fadeIn": 0.4,
        "fadeOut": 0.6
      }
    ],
    "sfx": [
      {
        "id": "ai-arrival",
        "preset": "alert",
        "at": 4.18,
        "volume": 0.55
      },
      {
        "id": "outsourced",
        "preset": "coin",
        "at": 6.28,
        "volume": 0.6
      },
      {
        "id": "role-drop",
        "preset": "heal",
        "at": 13.35,
        "volume": 0.62
      }
    ]
  }
}
